{
  "schema": "agent/priority-router@v1",
  "issue": 127,
  "updatedAt": "2025-10-13T16:11:40.911Z",
  "actions": [
    {
      "key": "hooks:pre-commit",
      "priority": 10,
      "scripts": ["node tools/npm/run-script.mjs hooks:pre-commit"],
      "rationale": "baseline hook gate"
    },
    {
      "key": "hooks:multi",
      "priority": 11,
      "scripts": ["node tools/npm/run-script.mjs hooks:multi", "node tools/npm/run-script.mjs hooks:schema"],
      "rationale": "ensure parity across planes"
    },
    {
      "key": "docs:lint",
      "priority": 20,
      "scripts": ["node tools/npm/run-script.mjs lint:md:changed"],
      "rationale": "docs label present"
    },
    {
      "key": "ci:parity",
      "priority": 30,
      "scripts": ["node tools/npm/run-script.mjs hooks:multi"],
      "rationale": "ci label present"
    }
  ]
}
