{
  "schema": "agent/priority-router@v1",
  "issue": 732,
  "updatedAt": null,
  "actions": [
    {
      "key": "hooks:pre-commit",
      "priority": 10,
      "scripts": [
        "node tools/npm/run-script.mjs hooks:pre-commit"
      ],
      "rationale": "baseline hook gate"
    },
    {
      "key": "hooks:multi",
      "priority": 11,
      "scripts": [
        "node tools/npm/run-script.mjs hooks:multi",
        "node tools/npm/run-script.mjs hooks:schema"
      ],
      "rationale": "ensure parity across planes"
    },
    {
      "key": "ci:parity",
      "priority": 30,
      "scripts": [
        "node tools/npm/run-script.mjs hooks:multi",
        "node tools/npm/run-script.mjs hooks:schema"
      ],
      "rationale": null
    },
    {
      "key": "validate:lint",
      "priority": 90,
      "scripts": [
        "pwsh -File tools/PrePush-Checks.ps1"
      ],
      "rationale": "baseline validation"
    },
    {
      "key": "validate:dispatch",
      "priority": 95,
      "scripts": [
        "node tools/npm/run-script.mjs priority:validate"
      ],
      "rationale": "dispatch Validate via upstream guard"
    }
  ]
}
